,tweet
1114,i dont understand myself i dont like lonely makes sad people makes anxious uncomfortable overwhelmed wtf this what i supposed do 
1115,anxious lately honestly rip strand hair head feel
1116,i anxious i want di
1117,im getting anxious aaaaaaaaaaaaaaaa
1118,i am anxious stressed thati am starting break hives body fun spend hours plan
1119,anxiou
1120,feel anxi
1121,soooo anxi
1122,woke anxi
1123,woke anxious fuck today thats fun
1124,u know u breathe cuz ur hella anxi
1125,be anxious heart
1126,i turned anxious mess
1127,feel anxi
1128,ive anxious lif
1129,reading things ptsd getting anxious bc relate lol need professional help
1130,im anxious fuck
1131,i m anxious 
1132,anxious rn
1133,feeling anxi
1134,feel fucking anxious escape room
1135,could anxi
1136,too anxious moment need tomorrow with to consequences fuck are 
1137,so fed feeling sad anxious time 
1138,i anxious kill me 
1139,oh today good day im feeling anxious fuck im gonna snap
1140,im literally anxious im going sick its going days relief
1141,anxious feeling 
1142,so i feel anxi
1143,feel anxious worri
1144,so im anxi
1145,idk i woke anxious today
1146,canr tell im anxious bc wouldnt understand bother bc god
1147,anxious suck
1148,i anxi
1149,i wake anxious af
1150,nan
1151,believed inherently lucky im sagittarius am lol and think im gna jinx thats works im divine blessed depressed doesnt help
1152,modern loneliness depressed yea 
1153,yea thanks reminder year anniversary loosing home horses lilac fire imagine im depress
1154,tell you ive super busy lately mean ive falling asleep couch avoid bed depress drag b
1155,i wake up alone spend time work alone work people feel alone come home house spend time bed alone sleep alone i wonder i am depressed 
1156,where life alert depression likeeeee help im depressed bed 
1157,yeah im depressed d epressed fe e ling bad p oopie r eally fucking apathetic ev e n worse s ad s earching live e vil d ead insid
1158,admittingly weeks ago i depressed with daily crippling anxiety i veer socmed while my anxiety bad i app remind breathe 
1159,im depressed like notice love ba
1160,so true banter response depressed 
1161,guys feel depressed 
1162,i understand pandemic i blessed job i home good lord i got masters degree work customer service live childhood bedroom no wonder im depressed aside pandemic and depression anxiety disorder 
1163,u dont understand how badly i need to move to new york city im depressed its the only way i stand a chance to meet justin
1164,birthday im depress
1165,god snowing im actually depressed its st december korea makes worse me 
1166,when telling patient youre impatient depressed day goes super slowly causes anxiety sky rocket 
1167,depress
1168,idk people knew irl follow follow liking tweets tbh like hello yes depressed like ik shit ur tl
1169,depressed im hot
1170,loser depress
1171,what kind sick freak isnt horribly depressed holiday
1172,every day depress
1173,my job reason i am depress
1174,so i am unemployed broke autistic bpd depressed i am typical useless man tch if i would foresight born nice normal parents lots money oh well better luck time 
1175,depressed i everyday 
1176,this morning i depressed wondering i day seeing im winner theyve cheered seeing kind
1177,depressed amirit
1178,and today s episode why do not i bed am i depressed lazy the world know
1179,i depressed lost soul
1180,i maybe depressed mentally ill traumatised piece shit i have posted picture holding someone s hand petit sunset biscuit playing background i live shit
1181,idk lately ive feeling super down stressed depressed everytime i look i
1182,feeling oddly depressed today amp theo crawled bed amp starts kissing face knows 
1183,im depressed good energetic mood is this alchemy 
1184,mom wakes bc works home i wake bc i am depress
1185,pooh pathology test diagnosed depressed autist
1186,im open advocacy mental health i forget im depressed as fuck like im sad tired 
1187,depressed gay
1188,im legitimately fucking depressed i never togami perfume i smel
1189,aint tht bad fuck i feel like im wasting life depress
1190,being depressed read comics weirdest frustrating experience happened like me and happens way often 
1191,guys idk i ve depressed quiet i am quiet happy today idk maybe cuz eat ice cream anyways good day afternoon night right
1192,i idea going me i feel depressed poss
1193,i think today i close breaking point i praying hopes idk ill grant given wishes truly depress right now 
1194,not mopey i demotivated depressed i am fed w
1195,depressed eating week
1196,it s kinda reason i wanna artist also kiss scene bubbline realize i am gay and i feel anxious depressed i like watch at help feel better it s helped lot way
1197,anyways ayyy im depressed getting shit
1198,i shut social media awhile i am depress
1199,depressed cba different food leav
1200,depressed im listining nf
1201,im depressed lazy shower floor usually kinda gross specific areas i wouldnt want lt 3
1202,have seen kevin loves interviews lebron left cleveland he severely depressed real hoopers know it is lebrons calls jus like wit it cleveland brung dudes there won left fucked contract
1203,getting ready th tailored therapy session yr old germany last week told worried amp depressed sessions is not more she said i think need different stages forward 
1204,im literally depressed anymor
1205,young dumb depress
1206,man i feeling good guess gotta horny adnd depress
1207,you want depressed abi
1208,why am i always on twitter when im depress
1209,sent sis messages twitter wanting die depressed regret seen delete shell sent delet
1210,he got depress
1211,my parents depressed puts depression time i talk them theres positivity shit theres left
1212,im sure im depressed i mean im sad but im exactly happy either i laugh joke smile day but im night i forget i feel 
1213,thats normal fact theres like year gap starting point nearly rank makes depress
1214,im depress
1215,im sorry i didnt follow cuz sh trigger bio depressed ass handle pics sh cuz hard stay away it im sorry i hope yall bett
1216,ive depressed life everything hits once i told person im actually going through bc im guarded idk im going year
1217,same happening me we students depress
1218,year forget seasonal depression obliterates ass yearly year im surprised im depressed season
1219,today im feeling happy love not mean im getting work no when comes work i depressed easily distracted phone hence im tweeting i answering emails 
1220,working amazon depressed i h
1221,swear i need snap fuck it i worked fucking hard sad depressed anything 
1222,i need shake bitch ass depressed mood 
1223,man depress fahking reason
1224,all i have depressed emotionally constip
1225,depress
1226,i dont mean confusion cute quirky way thought lost mind depressed weird extra miserable having hard time leading assumed finally lost it 
1227,i shamed able first it seriously depressed i tried hard second amp didnt work either like i failed nature amp kid nurses room w feel worst having baby 
1228,time shit like makes sad bc makes remember society set burnt depressed doesnt bett
1229,tw depression i feeling depressed grandad died im scared tell i pretend im ok im know depressed check
1230,im depressed stardew valley character sleeping entire months away activities app
1231,so sad depressed no knows cause i push emotions down but it is eating up lol 
1232,omg im depressed everytbing want corona depressed th
1233,i apprehend pronounce fact i going bed replying goodnight i depressed 
1234,depressed asf tonight order got cancelled card expired used card expired original release date items are not store anymor
1235,broken depressed i feel i think actual winters my kids both native floridians begging snow i am like it s great i promise you i think i hate cold single thing earth 
1236,yall slam word depression actually clinically depressed anytim
1237,in fact depress
1238,worst is possibly insanely depressed suicidal and checked im sure dont blood clots 
1239,barely man depress
1240,depressed month
1241,im confused depress fr
1242,not mention ppl like relate coz aint sunshine pls women sad too women depressed problems care women cheerful bright smh
1243,gotta love coming shower feeling depressed letting mind wander umpteenth time existential dread fun
1244,ayo who is depressed horny rn
1245,also im depressed okay listen makes happi
1246,i unproductive being i am depressed having handwork staying iddle disastrous i nid money buy shoe makin machine vry important a hardwork i amp many feeds frm life of a jobless graduate quite egregious pls help
1247,thats it im going back to the gym today and gonna stop being so damn depress
1248,depressed can t beat this 
1249,depressed kid
1250,bro i ve depressed like fuck character development stop horny making stupid decisions it is boring like literally u written note 
1251,online school depress
1252,yo we depressed depress
1253,depressed af
1254,woke little depressed usual today
1255,weeks fee depress
1256,senior year easy rlly hard im depressed bc certified nd college credit tim
1257,i feel depress
1258,making plans waking fucking depressed 
1259,false i am depressed 
1260,i tell i dont feel depressed mix both 
1261,can tell people mean i depress
1262,i depressed exhaust
1263,the bitch depressed the bitch me 
1264,depressed bcs nct came end 
1265,grams isnt depressing stay bed day lmao i depressed thats i staying bed hahahaha p
1266,the upper classmen boat about graduate unstable economy changing paths midstream accommodate possible job prospects they isolated depressed its bad around 
1267,im hurt im gone im angry im sad im depressed im im lonely im don
1268,its fucked people think internet people depressed suicidal fuck internet fuck heart love world idgaf bored laughs likes i heart 
1269,maybe im depressed i love good rainy monday
1270,i depressed year lot things happened familys christmas ruined help poor sister drew i smile face buying amazing christmas present i wrote poem
1271,lately feeling depressed sad feel numb lost i do not want talk all i want sleep till gets good
1272,tell u im depressed wanna kms leave home please dont tell talk mom cuz shes dominican tell shut fuck eat rice beans th day row
1273,depressed attack 
1274,looking forward growing look depressed horny amp high 
1275,matter mood im ill try post funny shit try negative depressed twitt
1276,just learned meds hating job getting depressed i want do but mooonnneeyyyyyyyi
1277,honestly will not regret it my dad depressed i got dog going walking got talking people reason up loves bits dogs prescription 
1278,my baby breastfed year ounce formula i pumping times day thank god i producing way milk but beginning heart breaking nothing come i cried depressed heavily 
1279,tome fly depressed wait 
1280,kinda annoying forgive depress
1281,i emailed advisor night really hard having listening voicemail open email making anxious 
1282, im feeling down upset sad anxious think im joking dont care that hurts know triggers me dont care that hurts more 
1283,realisation fact i ll month makes sad bit anxious depressed am 
1284,lets increase anxious self am hahahhah
1285,you right i anxious missed seeing thanksgiving sunday 
1286,anxious presentation voice shaky i speaking fast time i think fuck
1287,i feel way anxious virtu
1288,i could not sleep night bc i anxious finish cleaning house 
1289,yep im dming anxious friends help
1290,hate feeling omg making look bad saw people talking back not pls kind situation makes anxi
1291,just usual good bad i feel happy anxi
1292,wanna gc id probably anxious weird
1293,tw anxiety mention pls dont post did u dm type tweets ppl anxious reason u rlly tweet abt situation u v giving info possible abt dm tweet sr
1294,same thats happens i nap and yeah i totally feel you heart literally racing im anxious we fell deep pit honey pun intended 
1295,bro im feeling anxi
1296,yuck feel anxious today let us hope it is bc charts dropping goes away
1297,anyone anxious theyre anxi
1298, bored anxious come distract meeeee
1299,i plans today ive sleep
1300,feeling weirdly anxious dont know im gonna drop bc miss mark b
1301,i feel calm deep im feeling anxious thing tomorrow
1302,why feeling scared anxious panicked right ohmygod need read soft fic bad
1303,anxious horny 
1304,hour i ve reactivated im alr super anxious bad idea
1305,extremely nervous anxious dog vet today time big lump armpit is ugh
1306,i am anxious potentially mandatory it be i cannot imagine kind chaos that s gonna family in i am scar
1307,it s end semester usually i try stay calm positive right i have feeling absolutely crushed i am incredibly overwhelmed i am stressed anxious i will best stay active reply dms though ily guys 
1308,literally class i super anxious i hate it 
1309,i headspace well i feel fine bad dry cough got anxious af so i die i die 
1310,super exhausting anxious things i hit paus
1311,shits deadass making anxious i hate peopl
1312,i genuinely feel anxious reason pl
1313,to honest anxious thought people like of person i blocked guys following i lose friends knowing which i know is a reach but anxiety brain doesn t know that
1314,i am anxious phone calls dm someone 
1315,pls im anxi
1316,had filled in wanted sure i right i come back oh well being overly anxious bites butt
1317,sadly i m going missing opportunitites i m struggling it anxious interaction years straight fun
1318, what requests demanding says no i feel panic attack coming on 
1319,dont ask im scared bitch im anxi
1320,help its been so long i got anxi
1321,omg imagine anxious person im flying ajajajaj
1322,do i things overly tidy anxious arent tidy i feel keeping things tidy thing i control life i hate mondays 
1323,bitch im so anxious i know im gonna cri
1324,anyone working hours sleep pass night anxious going garbage job today because same 
1325,sooo anxious tiniest things pathet
1326,week doctors appointment anxious abt
1327,heartbreakingly sad i am feeling anxious live newfoundland cases rise near whats6happening parts canada i heard year old died day covid i think virus affect different ways 
1328,omg i feel this i cyst burst ovaries so anxious bc i bed week
1329,idk casual bc outside makes anxi
1330,i manage exhausted anxious week work
1331,bjdhjkoib iam anxious hope forthebest
1332,im honestly going apologize advance days im hardcore anxious observed tomorrow getting feedback wednesday as usual i unresponsive tunnel visioned thats why im purposefully ignoring yall 
1333,this weekend fucked im super anxious trusting lol fuck
1334,damn m anxi
1335,hate anxious peopl
1336,please wish luck uni exam tomorrow morning i am kinda freaking out i am anxi
1337,im anxious 
1338,feeling dumps discouraged today everything kinda sucks absolutely unbearable i feel anxious tense i dont know why 
1339,drop san lucas kun pics feeling anxious rn sr
1340,remember slap
1341,it s making anxi
1342,there so much training job i hope i anxious 
1343,y wondering worth somebody s life im anxious 
1344,i forgot patience i am sooooo anxious rn
1345,my so walked office arm antlers left spare chair i hom
1346,wanna quote tweet kind interaction makes anxi
1347,like count 100 panic attack anxious helps focus instead exam calm collect
1348,exactly mine worsens i cannot create i am anxious toxic 
1349,why i anxious mondays week now 
1350,i am stuck mental cycle i am lonely af miss friends want talk them cripplingly anxious year reaching cause i dont things talk probs decided arent friends anymore anyways my brain stupid
1351,ive awful day today ive anxious day apparent reason i havent eaten
1352,it makes anxious sur
1353,its getting end semester im getting anxi
1354,hope too im anxious bc everytime like bad happens g
1355,helping anxious boards sorry having bad day
1356,anxious hop
1357,i generalized anxiety disorder i eased in i guess depends person end day like smoking helped tremendously social skills anxious thats me it different peopl
1358,double anxious u ll cur
1359,thank im lonely anxious thank
1360,i am anxi
1361,genuinely anxious solid week 
1362,im maths homework crying feel horrible teacher makes anxi
1363,terrible anxious night late bus disaster maths lesson but i ppa create maths gap lesson tomorrow got home early i know i late finishes week i am making cheese mac cheese trying hard create positives i am exhausted 
1364,idea extremely anxious makes clear like me ignore act like idk
1365,feel anxious ugh 
1366,drink diet coke like it will stop sad anxi
1367, i woke feeling anxious ugh i need episode alsnakznsnx
1368,i am shy awkward dumb anxious introvert reason needs hang cuties i like attention jazz cannot properly because i said dumb shy awkward 
1369,dont wanna sleep early weather s getting cold struggle breathing night idk that s actually reason tho anxious bcoz dont wanna d word gasping air lmao
1370,wake check ways ongoing conversations people need attention slack whatsapp multiple emails sms facebook anxious forget breakfast
1371,last week i shared anxiety waiting i worried angry me spent days anxious nothing wrong he mountains getting needed rest 
1372,and begin process changing antidepressant im anxi
1373,my new rule exercise i anxious sing afterwards work
1374,pls results making anxi
1375,i feeling emotionally drained i tried nap im light sleeper phone rang twice happens gives anxiety im tired im anxious pissed im nap person i know smh 
1376,jajdjajwne im so anxi
1377,im anxious exam chest hella tight i feel like i breathe wow i wanna di
1378,id anxious happy hajsjsjdjjssjsj
1379,socially anxious play chess onlin
1380,even wale hours work im srsly anxious sleep
1381,i anxious different tools i reason it i prefer having place typing quicker writing need draw well that s i stopped laptop went pen paper lol
1382,send johnny photos edits johnny im extremely anxious work today
1383,had session morning ended discussing therapist surviving zombie apocalypse still meds i guess im fine i hope i am i feel fine okay im anxious thinking it 
1384,i lab tests yearly physical yesterday they starting trickle time i notice i feel anxious i dont know why i extremely healthy i worry things me i hate looking i look 
1385,unmotivated anxious exhaust
1386,gotta presentation today anxious wish luck
1387,im fucking anxi
1388,anyone feel super anxious today 
1389,literally ppl stopping makes anxious im posting makes happi
1390,yeah i dont think i cheat and way anxious try st
1391,the anxious bit i mean 
1392,haha feeling anxious reason
1393,i am anxious awake not sleep
1394,i m getting anxi
1395,i dont think i shoot shot im built like that im anxious i sit wait come thats ill bitchless forever amen
1396,do yall pick skin youre stressed anxious like normal i need help
1397,yes i rmemeber i was so anxious but then i was like theyre all dumb
1398,shit makes anxious like im fat anemia asthma im speedwalking stop
1399,anxious going work tomorrow bc i talk boss issue i dont want i want i stop anxi
1400,anxious stop fcking stop
1401,feel anxious phones oh god
1402,after severely low anxious interval i am trying again well i am low anxious i do not know appointment freaking the fuck out is i will i get 
1403,nervous excited nerve wrecking anxious patiently waiting 
1404,im anxious omg
1405,i studying i am anxious skskjjdjd
1406,i anxious i hate lol
1407,theyre people unsure tone anxious like me 
1408,im getting little anxious rn pls stfu
1409,ooh bad i am anxious moment cannot think right i am sorry 
1410,you making anxi
1411,i am so anxious help
1412, anxious bundle nerves what day
1413,i anxious 
1414,people believe i think high myslef i do not talk easily much when truth i anxious shy two good friends impression met changed minds got know other 
1415,i do not know everyday feel tired nothing excited anymore if left sad nothing i anxious does not happen one day i am happy af month roller coaster mood 
1416,requirements left finally i break anxious scared past days 
1417,anxious simply distracting daydreaming comfort album refreshing twitter thirty second
1418,all time i start getting anxious hate ill reread messag
1419,today i thought i anxious woke early ready anxiety hit me but instead i want bake parmesan rosemary focaccia rest head xavia tiddies crazy u prepare doesnt exist
1420,hate going class anxious going jsut makes jt wors
1421,i sleep bc im anxi
1422,said got anxi
1423,sigh anxious talking peopl
1424,ty im hella anxious but well see how everything go
1425,yall anxious fucking spasm
1426,im anxious sad pls yall send doyoung winwin jaehyun pics need rn
1427,anxiou
1428,so nervous tonight dont want anxious 
1429,i semi anxious thoughts i recognise theyre having physical effects them so i dont shake point i eat anymore mad 
1430,literally online classes anxious idk
1431,anxious anymore writing college essay homework
1432,please i experiencing immense indescribably anxious tendencies and or feelings clingy esque attitude please i wish referred pogchamp i instead require platonic means trust lack interactio
1433,knowing class makes anxious like anxi
1434,im nervous anxi
1435,its early week anxious bc work
1436,whats making anxious 
1437,woke fucked dream wanted punch fuck man 
1438,i anxious barista judge asking caramel coffee despite fact i barista asked wild shit
1439,ahahahaaaaaaa im anxi
1440,damn heartbreak feel motivation everyday everynight felt anxi
1441,im anxi
1442,i am anxious math trying help kids constantly second guessing myself 
1443,anxious forget im anxious remember sudden way anxi
1444,bitch im anxi
1445,im tired day im buck stars feel anxious working boss again im going set successful day work days day off got
1446,functioned hours sleep today i highly anxious truli
1447,im tired overwhelmed anxi
1448,i getting random moments i hella anxious mom
1449,we got food headed schoo when got schoo everybody starin whispering shit i got anxious pulled von whispered m von ion like v like m starin shit v lets sum stare them 
1450, i am anxious today ahhh new episode dont know when or time hnnghhh i thinking today ahhhhhh the anxiety killing me 
1451,tried apply job field started having panic attack halfway through i dont know ill able it 
1452,i am absolutely dreading having school today
1453,hes mins away im literally anxious im ascend
1454,been hella anxious sitting news reading info simmered clean out 
1455,i need way high i am anxious i do not want to specifically cases slipping house light blunt is not realistic 
1456,omg i m anxi
1457,she kept moving i getting anxious i miss pretty perfect but finally stood still and far tree standing 
1458,im anxious deal live like anymor
1459,my life goal stop anxious everything as sit having fear work having mild panic attack im going die work
1460,i am quiet socially anxious school shit i stg i did not panic attack i do not know looks i rule damn place lkjsdhgkd i am chill know tbh people clue class
1461,making anxious send help wash im afraid touch
1462,man i anxious going work today the monday holiday clusterfuck 
1463,i think girlfriend fake orgasm girls that ask like s you need ask maybe maybe shes uncomfortable anxious dont wanna long
1464,i overwhelmed incredibly anxious haha
1465,exactly autocorrect switched np i am overly anxious and i send it 
1466,want feel anxious bubbl
1467,hate anxious tjm
1468,like good way yanno time feel anxious thats probably im calm happy like week im working hours thats ive asking shit life good
1469,feeling anxious waiting trying assignments m great m great
1470,feel like i m forgetting smth it is making incredibly anxi
1471,i do not know exactly i have done thank you my social anxious ass happy society going ignor
1472,i do not know i feel compulsory feeling but shit sucks sometimes but grand scheme world shit sucked before humans things like before and scared look moment you are in 
1473,yeah i phone down thanks letting know i try anxi
1474,anxious af
1475,im anxious im anxious im anxious im anxi
1476,idk feel anxious scared reason
1477,im anxi
1478,benadryl nyquil codeine do not sleep they anxious hyper feeling like i climb walls cannot sit still cannot sleep 
1479,lord feel tired unmotivated sad anxious between none vacation trips hours sleep away idk 
1480,eh i woke anxious dunno
1481,im stressed anxious work sucks right w
1482,hi feel free send things dont mind im bit anxious 
1483,i woke feeling anxious morning 
1484,imagine having exam days unable study anxious help i stop hands shak
1485,i capable controling emotions great success except comes anxiety i angry you know sad good luck figuring out happy you tell but anxious you tell looking moment 
1486,my psychiatrist busy tried best fit schedule tomorrow as i am looking forward meeting her i feel numb 
1487,damn evryone anxious including know boys too bb drop chart already dont this 
1488,i feel anxious morn
1489,so i have told i guess i am anxious unqualified good news 
1490,forever anxious continue ranking wr riot showed powerful matchmaking teaming unranked players im promo
1491,nah women should i annoy
1492,huhuhu ya gitu i am tired starting day feeling anxious single morn
1493,this good thread as learned attachment style anxious avoidant ambivalent upbringing important information 
1494,i am gonna drown sorrow lot s coffee caffeine does not mix medication anxious reactions hahahaha rip vadeyi
1495,anxious futur
1496,hella anxi
1497,ur making anxi
1498,super anxious committee meeting week likely determine im ready defend graduate months ahhhhhhh
1499,car anxi
