,tweet
622,praisegod hallelujah im depress
623,my parents tell i reason depressed anxious i dont know thing it years countless bad days multiple professional diagnoses handful stays hospital mean i guess
624,i depressed game i gotta i wanna know friend
625,im needy rn im super depress
626,im depressed i wanna high listen great fuckin music me 
627,every time im depressed i legit watch movie myself today bumblebe
628,god im depress
629,i am just depressed i love too its beginning look lot like depress
630,no thats im depressed lon
631,iiiiii depress
632,depressed fuck
633,depressed tired nobel me 
634,im psycho smart depressed scary combination i worried i handle certain situ
635,im bath drowning wine im supposed drink like two cousins siblings announced night theyre having babies im depressed when turn 
636,i have bed day feeling super depressed shit ugh
637,my physical mental health getting worse past days i do not know what is happening i am super depressed anyways i am probably going delete tweet hour it is stupid
638,i love feeling self destructive depressed midnight and wanting die i looooove it
639,am i actually depressed i listening bottoms 
640,feel like i m drowning truly blessed time i m depressed smack fac
641,hi i am depressed i do not want leave bed like ever 
642,offense byt im depress
643,some depressed christin
644,ive depressed heckkkk amp social anxiety force i able force gym 
645,shits happen
646,i m depress
647,i need draw im tiiiiiired sorta depressed thats point
648,getting drunk deeply depressed amp sitting dark room night going 
649,it lil bit depressed now dont mind
650,aint pill world gone stop depressed ass kil
651,depressed depress
652,i love family i depressed amp unmotivated i stay augusta longer week 
653,i do not think i have depressed worried year i thought i would feel like again 
654,im big depress
655,is normal moods switch fast happy depressed or time year 
656,been this depressed in a very very very long time might b dying stay tuned ex bf post public ment
657,the way ive eating today im depressed come on both options suck 
658,cant explain depressed i fact im im work tomorrow
659,feel depressed work tomorrow
660,depress
661,i am fucking depressed i hate there s reason wtf but i reach help of course bc i am dumbass
662,depressed lonely horni
663,i cried like 7 times time feel insecure depressed anxious 
664,also i depressed i tir
665,i fucking depress
666,im depressed gay
667,arms numb drinking week depressed gym past clean system bank account negative not bad i hear bitcoin traders offed themselves 
668,i am depressed i appreciate you are helping person 
669,sooo thats im depressed single ok
670,i sad depressed want do not anywhere 
671,depressed everything 
672,i am distracted depressed today i locked hous
673,im depress
674,i am drinking gin tends depressed i am crying little total eclipse heart bonnie tyler help
675,im depressed person know
676,i depress
677,wont admit im depressed bc relate sadness amp dont feel sad music doesnt sound good anymore amp dont comedies funny amp motivate things productive amp oversleep mornings fall asleep night
678,holiday feel lonely depress
679,even i am depressed i hard open clos
680,depress
681,depressed hous
682,i admit i have depressed i hit wall ouch
683,feeling depress
684,alright depress
685,i am depressed 
686,im fuckin depress
687,unfortunately i am depressed u notice november i have not hyperactive twitter i invest time looking opportunities abroad i help test if i succeed extent maybe i come depression 
688,depressed weight im having mulled wine try block
689,i have depressed it s terrible thing sometimes talking people does not change it you need change atmosphere feel new things it book read helped me 
690,am i actually depressed i hungri
691,im quitting youtube cares anymore im going issues right im depressed feeling hopeless i started cut gives damn im sign
692,went doctors today asked i feeling depressed lately lie no 
693,ive depressed life last night worst times ive cried long hurts my eyes hurt my heart hurts but i know better 
694,feeling depress
695,im depressed lol
696,i feel getting super depress
697,dont think depress
698,i just know im finna be sick amp amp depress
699,stay depress
700,i feel old sad depressed idk i feel bad xd
701,im depressed w 
702,im depressed and horny all the time soooooo maybe anti depressant perfect solution 
703,i have seriously gained ton weight i loss i swing forth pissed depressed it but done 
704,i am sad lonely depressed anxiety anxious tired upset heart broken me 
705,is bad i quit playing guitar normally i motivation i slowed streaming i motivation anything i damn depressed 
706,anyone feeling depressed pissy today lolol
707,wow i feel depressed af yay want lay b
708,christmas finally over now i continue depressed norm
709,date amp half hours im depressed f u c k want cancel dont want let mental illness ruin life pls help
710,feel depressed moment lmao think i need start taking medication daily point 
711,i definitely binge eat im feeling depressed lot anxiety thats things i count holidays lots anxiety lots readily available food 
712,damn im trying positive hit like truck im depress
713,if ct friends wanna hangout today let know im feeling hella depressed want company i think
714,sometimes i want scream family do idea depressed i am type family believe mental illness i would dubbed drama queen thrown right lonely rhythm 
715,number problem mine im clinically depressed introverted extrovert i need surrounded purpose people times things mad anxiety its fun time 
716,i good track record i ll good companion trust me by way m depressed it s pretend otherwise 
717,i wonder i doctor lately i feeling empty hungry eating much tired depressed wrong me 
718,im depressed fck
719,i am miserable even though holidays supposed happy cheery i am miserable sad i am depress
720,maybe i am depressed 
721,i real life depressed night dear god
722,i returned work today i bored and depressed i want retire 
723,the depressed i entire lif
724,oh im depressed depress
725,sick depress
726,literally i win i depressed miserable christmas finally holiday i smiled i feel depressed miserable f winter lif
727,i dying inside i depressed tired introverted i year week i non stop spend time people to boot it is unique special occasions people state year i cannot bail 
728, depress
729,mean happy memories year cannot remmeber year felt depressed miserable there 
730,im going single fuck depressed fuck jobless weeks christmas recently lost family member huge issues social anxiety motivation so honestly im ready 
731,im depressed gotta start over 0 9 rip outfits had salmon run shiz gone lt 3
732,told husband depressed asked diagnosed me lol understood ppl bottle depressed 
733,when i tell people i am feeling depressed they re like ohh noo why maybe it is it is mental illness susan 
734,i depress
735,i usually reply sike i am depressed 
736,part feeling seriously depressed wants ugly wants seriously drunk high 
737,im happy family sisters i fucking depressed im glad sunny least im just fucking man seriously 
738,i b depressed ya gurl making moves 
739,the best depressed holidays having drive son school 
740,im ready new year im ending year lot depressed i started it ive learned lot now ive learned bett
741,dont know im depressed i actually want cut bangs 
742,i am sad lonely depressed anxiety anxious tired upset heart broken me 
743,i dont know paid debts n600k great family house issues great job why fuck i depress
744,feeling depress
745,i depressed knew i crying morning afternoon night not mother brothers live roof seeing time fact i happy depression explainable jar
746,been bad year doc havent hit target markets harsh uncertain im depressed take break charts the great shitposter pick memes trader bursts tears but doc i great shitposter i mem
747,imma real man depressed im
748,mom called depressed suicidal teenager i have felt like shit life 
749,now im depressed wana bed lol
750,id like nice depressed probably fit
751,depress
752,confusing depression loneliness depressed im lonely 
753,definitely depress
754,depressed af
755,i dont feel mentally calm stable work counselling want crawl bed got hrs im work
756,rp im bored depress
757,everyone thinks im living best life ima honest shit sucks complete ass tired depress
758,when i depressed 
759,sucks depressed but isolate guess
760,tomorrow it is just thinking makes feel exhausted anxious depressed in likelihood i is not close i studied hard for i feel like failure i am sorry i out 
761,did not feel like holidays probably i slightly depressed time cannot wait new year amp slumpy rut i m in 
762,one thing i hate depressed suicidal family feels pick choose information think i handle 
763,im depressed im lolnely im tired i wanna fucking die i hate my life and no one cares about me fuck m
764,depress
765,i do not know fucking useless talking does not anything i do not know do i do not feel i am risk myself cripplingly depressed i want feeling way do not know how 
766,i depressed amp bitter couple years but i am wok
767,i depressed monday somebody funk
768,what supposed exhausted want days fast possible feel like piece shit depressed sleep
769,shit know im depressed shit
770,watching i m depressed af
771,anddddd im depressed 
772,i miss christmas i think im actually depress
773,i believe im going depressed fuck damn
774,im depress
775,im depress
776,i am sad depressed it is funny anymor
777,depress
778,i depressed easily little things set off but i i talk to 
779,depressed bipolar borderline personality disorder image having traits pass
780,too anxious too depressed digging deeper deeper familiar hol
781,to honest ive pretty depressed i took medicin
782,so constant urge light come deeply depressed autistic person spending time social media nobody knows 
783,depressed bed alone company numb
784,depress
785,i depressed af vibe way good i wont let problems fuck you live happy life man enjoy shit lord knows i wouldnt want bring high so dont worry me enjoy 
786,no i in huff no i am sensitive today i am depressed i am consumed building rage patronising helping 
787,i am sorry depressed ass
788,i do not talk lot people anymore more depress want something 
789,i am depressed thinking abt birthday lol
790,depressed piss
791,lol ma brithday im depressed cause wanted born hurt life have dont want it 
792,telling work im sick dont figure depressed i
793,i knew i reaaaally depressed i slept day christmas 
794,i am depress
795,tbh probably depress
796,so fuckin depress
797,depress
798,im surprised im feeling bit depressed today i wanna lay bed possibly hour two maybe ill family gone 
799,idk im depressed pmsn pregnant definitely go
800,depress
801,i do not know i tweet this i feel like writing what is going head help me 12
802,work i got break making depressed 
803,whats depressed bitch gotta held
804,i am depressed today hurt total wreck general i need better living 
805,im controled random different circumstances feel fucking depress
806,i am depressed huggu someone 
807,well i woke depressed asf lol
808,depressed whats new
809,imagine able cease depressed i
810,depressed lik
811,so depressed lol
812,im depress
813,felt depressed unwish live sad music help much how long i it 
814,im depressed idek
815,stressed depressed need advice hear dm the convo
816,just frustrating im depressed anxious i reason be cba
817,why i depressed angry time 
818,depressed reading tweets like depressed smil
819,way family event and im depress
820,depressed 7
821,im depressed loved noticed liked me dont know tbh el ryal mb m39oob dam ma y7bch w gb gulo men players men trash real silly girls fuck m
822,depressed talk
823,i want im depressed rn
824,my brain broken like i do not know i have depressed years i bang updated resume recruiter i showered clothes like goddamn adult 
825,depress
826,i am wondering depressed i want life may stage dear jesus 
827,i depress
828,been nice depressed nearly years comes territory point 
829,depress
830,finally shaved looks like im depressed actu
831,feel depressed reason today smh
832,depress
833,depressed definitely depressed 
834,depressed af man 
835,gay depressed anxi
836,i want happy im tired depressed sad time 
837,what im depressed i suck 
838,o fuck im depressed 
839,idk anymore getting depressed sitting room crying second im work
840,i am point i do not mad i fail i depressed 
841,woke feeling depressed asf ye y
842,i v v v depressed right now 
843,im fucking depressed right
844,depress
845,definitely depress
846,depress
847,depressed hhhhh
848,i depressed kid
849,depress
850,depress
851,depress
852,i turned today i supposed feel depressed 
853, insert depressed tweet here 
854,is bad im just getting bed getting day started i swear i hella depressed weekend good god man i energy i wanna sleep adorable pictures i dont know this annoying 
855,im depressed ugh wow 
856,so depressed feeling like miss idk
857,jokes you im depress
858,im literally depressed lol
859,ive depressed lately amp honestly i blame i knew right thing i stupid i didnt believ
860,i trust issue it is reasons i depressed self far away peopl
861,depressed welcom
862,im depressed hope youre happi
863,depressed im lit
864,please ask things i am depressed 
865,fucking sucks depressed holidays unbelievably frustrating half brains shut barely energy talk time supposed fun happy im enormous buzzkill hate it 
866,im depressed today i allowed month binging gained a ton today gona restricting nope fucking binged my dad home purge wanted tho but good holiday i wana die bc gained 
867,you depressed af right
868,im depressed now thank you 
869,apparently i am gonna super depressed today ok this inconvenient 
870,im tired depressed 7 know day wont feel like tiring requires dedication function hate like literally friends im anyways thinking lol
871,tw angst lol anyways depressed af wish alive please kill thank
872,christmas stop fake depress
873,im going miss pregnant all im literally depressed time way i look face getting fat spikes depression anxiety 
874,i dont know im depressed disgustingly selfish
875,ok im depress
876,depressed 
877,im lazy im depress
878,im depressed fuck living best life time dont ask
879,depressed af
880,if i wasn t depressed work tomorrow cunts play like that 
881,bored lonely depressed what combo
882,basically depressed shit 
883,depressed amp left lol
884,right ive enough friends celebrating christmas abroad im sitting depressed weight ive gained holidays i wanna sunning beach cocktails sitting rooftop bar manhattan listening jazz over n
885,been depressed lonely past day
886,im depressed fuck ive spending break bed endometriosis kicking ass wack 
887,depressed 
888,i swear im sick tired depression i anymore im going i stay depressed place 
889,fair i depress
890,depressed 
891,clinically depress
892,i am suicidal i am having bad day does know good texting support based service i am ok i do not want family overhear anything 
893,ps suicidal want break brain nightmares ive hav
894,the panic attack i having feeling suicidal making feel suicidal im going ok people need fucking hurt i hate it 
895,i have lot mental torture week since night i developed cold like symptoms feel shitty physically mentally my toe broken i suicidal and excuses i deleted piece shit i have spent hrs paint
896,i am suicidal i do not wanna fucking die i wanna able close eyes feel alright
897,sad music amp suicidal thoughts lesssssget oblock bang bang
898,aye suicidal shit wait fucking die lol
899,been suicidal af sucks trying stay strong everyday 
900,suicidal thoughts time time normal 
901,going suicid
902,talking making suicid
903,literally do not know i come home parents cause arguments degrading belittling do not better they probably of reason i suicidal depression anxiety wrong
904,feeling super super suicid
905,i told family year college causes stress wanna commit suicide im suicidal amp looked like i insane amp told quiet black families think bc kids amp little bills life easy amp stress fre
906,i going lot people scream me but recently i have suicidal i cannot reason left live i am saying to easy get tweet i am sorry i have tried nothing s work
907,i honestly want better instead anytime i receive text message does not sound like it is good tone i wave suicidal thoughts start making emotionally unavail
908,i wanna trip n lay bed suicidal lmfao
909,suicidal shit id dead
910,and i am suicid
911,borderline suicid
912,whenever suicidal thoughts creeps head i think mom does not deserve that 
913,suicidal want di
914,i am suicidal send help
915,i emotionally drained i tho talking stuff feel better i felt numb entire session suicidal right
916,i am not gonna lie i m suicidal but i amazing bang styl
917,i know strategies help deal i need medicine works i legitimately suicidal im experiencing depressive episode point feels like help shit 
918,id like stop having suicidal thoughts 
919,me person lives diagnosed anxiety depression history expressing suicidal ideation told whisper wind i look outside ill receive free beyonc tickets 
920,do not high fuck it diagnosed highest levels bipolar disorder amp depression medication keeps level giving suicidal thoughts i get high to stay leveled out and sane stfu 
921,will i be committed mental hospital i tell therapist suicidal thoughts 
922,how tf i suicidal thoughts i parents i hate girl
923,i feel i write thread on being raped being slut shamed being abused partner being stalked being suicidal but intertwined 
924,im suicidal im genuinely fucking tired al
925,me im bad bitch kill me my depression suicidal tendencies 
926,tw si wow love getting suicidal working therapist crisis calls texts tomorrow
927,suicidal thoughts running brain
928,feeling suicidal start paint
929,feeling suicidal chili s tonight
930,trying outside interact society suicidal ideation com
931,omzzz suicidal thoughts eh
932,i decided i suicidal tonight
933,i disgusting person i fucking hate fucking use feeling suicidal i ne
934,idk hv suicidal thoughts not but dont think life meanings anymore i tried void having take break from everything go short holiday you alone go complete calmn
935,goddammit i am fucking suicid
936,my friendship ruined i things single mind deal lot people get suicidal thought 4 times date free panic attack last least i got anugerah pengarah 
937,feeling extremely suicidal ugh
938,proper sick feelin depressed suicidal holiday period death bro
939,i feel suicid
940,damn thats crazy pms makes suicidal 
941,i am suicidal can t life but thing i am feeling i do not understand there s plain emptiness i feel dead 
942,songs wake inner suicidal self
943,my suicidal thoughts starting pile friend dropped word owe money it is got twisted knots 
944,as high functioning suicidal person donating blood making sense cutting or shaving ur neck till bleed indeed 
945,feeling suicid
946,kind music save suicidal thoughts do not dare judge listen do not know stori
947,suicidal type shit wish dead right
948,am suicidal thoughts comim yeah
949,it s lovely i suicidal time lik
950,im trapped life sadness suicidal thoughts 
951,phew months clean self harm wonder ive suicid
952,hi im suicid
953,i went home cuz school making depressed suicidal oh guess what home impact like school where i neutral environment 
954,oh fucking god i m feeling suicidal work
955,i hide mental illnesses suicidal thoughts self harming behaviours years since i years old no family noticed it lol 
956,murder murder mind suicidal tim
957,also suicidal 
958,how rid suicidal thought im scared gonna win
959,im havinf mental breakdown im suicidal im se
960,and i suicidal 
961,suicidal lif
962,forget suicidal wonder feels lik
963,tired feelings suicidal thoughts driving crazy 
964,i do not know i i survived suicidal thoughts year i attempts i lucky recovered but i learn something i learned i suicidal thoughts delve fully surrendering stay
965,i told game brainwashes wanting survive but i am suicidal 
966,woke feeling suicid
967, depressive suicidal thoughts intensifies 
968,suicidal thoughts haunt mind i sleep 
969,suicidal thoughts iz freakin crazyyy 
970,suicidal thought
971,suicidal thoughts 
972,wow feels suicid
973,no suicidal shit ion want life anymor
974,lmaoooo okay son u suicid
975,i am having suicidal thoughts today please ch
976,suicidal sooo fucking fun lmao
977,suicidal thought
978,nothing suicidal i dont want anymore 
979,no suicidal shit fuck
980,i went facebook feel legitimately suicidal 
981,suicid
982,i am suicidal i do not wanna fucking die i wanna able close eyes feel alright but everyday i feel like dying 
983,teehee im like suicid
984,im depressed amp suicidal rn
985,you tired you are suicidal bc
986,feeling super super suicid
987,suicidal on
988,suicidal thoughts dangerous do not peddle messages do not kil
989,i am amp suicidal st xmas dad amp boyfriend amp i got huge fight
990,go bed suicidal wake suicid
991, yes im suicidal send help
992,she love son recognize one and people wonder i suicid
993,live footage suicidal ass going sleep earthquake knowing there s real chance wak
994, suicidal thoughts 
995,it s christmas i am suicidal 
996,i rlly rlly want suicidal thoughts away pl
997,hehe suicidal knew 
998,apparently pattern feeling suicidal reaching out changing mind moment ignoring problems smoking stupid isnt getting anywhere 
999,depression sucks being suicidal sucks worse 
1000,feeling super super suicid
1001,wonder im suicidal tim
1002,extremely suicidal lmao
1003,taking drugs feel suicid
1004,suicidal yay
1005,feeling super suicid
1006,merry christmas everyone i suicidal thoughts 
1007,no suicidal shit i deadass wouldnt mind waking tomorrow life sucks i
1008,depression worse time the loss granddad thousand step back suicidal thoughts started haunt dont think fight anymore i tired 
1009,work making suicidal usual today
1010,normal suicidal christmas cause ho ho ho kid
1011,i bring suicidal thoughts cause mom police theyll tell pray church i believe god thats thing helps therapy helping alot 
1012,feeling lonely i wants lmao
1013,feeling lonely asf ugh
1014,feeling damn lonely tim
1015,im feeling terribly lonely today ugh
1016,fed feeling bloody lon
1017,feeling lon
1018,hate feeling lon
1019,feeling sad amp lonely 
1020,lol i am feeling lonely today
1021,feeling lonely af right
1022,feeling hopeless lon
1023,woke feeling lon
1024,feeling lonely and do not like that 
1025,im feeling lon
1026,feeling extra lonely dayss
1027,i feeling lonely 
1028,wtf i feeling sad lonely suddenly 
1029,feeling lonely today
1030,i am feeling lon
1031,im tired feeling lonely end day makes feel worse bc i dont want burden anyone i dont know im going hurts way
1032,im feeling lonely ever 
1033,i feel lonely time and makes feel angry i hate feeling angry i start hate myself and i start hate i start push people away i push people away i feel lonely so turns beautiful cycle 
1034,feeling lon
1035,feeling lon
1036,ive feeling lonely l
1037,feeling extra lonely days 
1038,im feeling lon
1039,feeling hella lon
1040,hmm feeling lon
1041,feeling extra lonely day
1042,feeling lon
1043,feeling v v lonely rn
1044,feeling lonely sad goodbye 
1045,im tired feeling lonely tim
1046,feeling lon
1047,feeling low feeling lon
1048,feeling extra lonely days 
1049,feeling lon
1050,feeling lonely rn shit
1051,feeling lonely shit 
1052,feeling lon
1053,really feeling lon
1054,feeling lonely amp sad
1055,feeling lonely lol
1056,feeling lon
1057,ive feeling lonely lately 
1058,feeling sick lon
1059,ah there s hopelessly lonely feeling i thought gon
1060,feeling fucking lon
1061,tired feeling lon
1062,i feel helpless
1063,feel helpless defeated 
1064,helpless
1065,i m helpless monst
1066,i feel helpless i truly h
1067,if im helpless tell now 
1068,feeling helpless
1069,i feel helpless
1070,im tired feeling way i feel helpless 
1071,feeling helpless worst feeling world
1072,i helpless 
1073,im helpless
1074,feel helpless
1075,helpless 
1076,helpless 
1077,helpless 
1078,im fucking trapped helpless i do not know
1079,i know there s wrong i am helpless
1080,never felt helpless
1081,kill
1082,hate feeling helpless shit annoying fuck
1083,sure feel anxious today
1084,v anxious v sad
1085,im anxious afffffffffffffffffffffff
1086,i afraid talk feelings i know people angry worried so despite feeling anxious time i talk it i worry i will worse time know why 
1087,oh gof im anxious rn thatsss cut
1088,i feel anxi
1089,woke anxious af dark
1090,sitting fucking anxi
1091,i m anxious i want feel better talk whatever i joy feeling way i flip switch feel good positive i heartbeat 
1092,anxious 
1093,im anxious suck
1094,i m socially inept anxious internet
1095,trying anxious 
1096,i anxious stupid shit
1097,idk im anxious rn help
1098,i anxious today
1099,anxious lol
1100,i sad anxious evening 
1101,im anxious right about what i dont know i w
1102,feel anxious today cannot focus do not wanna
1103,i entire week relax why i anxious 
1104,feeling anxious youre sick stomach great feeling do recommend
1105,im anxious fat ugly lonely dumb
1106,im anxious i feel like im gonna pass
1107,im anxious rn
1108,im so anxi
1109,im anxi
1110,anxious hell today reason hehhee mental il
1111,im anxious rn i feel like shit
1112,feel v weird anxi
1113,wanna fight im anxious emot
